[
  {
    "ku_id": "KU-0001",
    "entity_key": "japan-travel:pass-ticket:jr-pass",
    "field": "eligibility",
    "value": "일본 국외 거주 외국인 여권 소지자. 'Temporary Visitor' 체류자격으로 입국한 자만 구매 가능. 일본 국적자 또는 일본 거주 외국인은 구매 불가.",
    "observed_at": "2026-03-02",
    "validity": {
      "ttl_days": 90
    },
    "evidence_links": [
      "EU-0001"
    ],
    "confidence": 0.95,
    "status": "active"
  },
  {
    "ku_id": "KU-0002",
    "entity_key": "japan-travel:pass-ticket:jr-pass",
    "field": "price",
    "value": {
      "7일권": {
        "ordinary": 50000,
        "green": 70000
      },
      "14일권": {
        "ordinary": 80000,
        "green": 110000
      },
      "21일권": {
        "ordinary": 100000,
        "green": 140000
      },
      "currency": "JPY",
      "비고": "2023년 10월 인상 후 유지. 2025-2026 추가 인상 없음."
    },
    "conditions": {
      "channel": "일본 국내 구매 기준",
      "traveler_type": "temporary-visitor"
    },
    "observed_at": "2026-03-02",
    "validity": {
      "ttl_days": 180
    },
    "evidence_links": [
      "EU-0001",
      "EU-0011"
    ],
    "confidence": 0.95,
    "status": "active"
  },
  {
    "ku_id": "KU-0003",
    "entity_key": "japan-travel:regulation:tourist-visa",
    "field": "policy",
    "value": "한국 국적자는 90일 이내 관광 목적 무비자 입국 가능. 여권 잔여 유효기간 제한 없음 (체류 기간 이상 권장). Visit Japan Web 사전 등록 권장.",
    "conditions": {
      "traveler_type": "korean-citizen"
    },
    "observed_at": "2026-03-02",
    "validity": {
      "ttl_days": 90
    },
    "evidence_links": [
      "EU-0002"
    ],
    "confidence": 0.9,
    "status": "active"
  },
  {
    "ku_id": "KU-0004",
    "entity_key": "japan-travel:payment:ic-card",
    "field": "how_to_use",
    "value": "Suica/PASMO 등 IC카드로 전철, 버스, 편의점 결제 가능. 물리 카드 재고 부족은 2025.3월 공식 해소. Welcome Suica(관광객용, 28일 유효) 주요 역에서 판매 재개. 모바일 Suica(Apple/Google) 및 Welcome Suica Mobile(iPhone, 180일 유효) 이용 가능.",
    "observed_at": "2026-03-02",
    "validity": {
      "ttl_days": 365
    },
    "evidence_links": [
      "EU-0003",
      "EU-0016",
      "EU-0017"
    ],
    "confidence": 0.85,
    "status": "active"
  },
  {
    "ku_id": "KU-0005",
    "entity_key": "japan-travel:transport:shinkansen",
    "field": "how_to_use",
    "value": "지정석(Reserved)과 자유석(Non-reserved) 구분. JR Pass 소지 시 지정석 무료 예약 가능 (Nozomi/Mizuho 제외). 자유석은 선착순 탑승.",
    "observed_at": "2026-03-02",
    "validity": {
      "ttl_days": 365
    },
    "evidence_links": [
      "EU-0004"
    ],
    "confidence": 0.9,
    "status": "active"
  },
  {
    "ku_id": "KU-0006",
    "entity_key": "japan-travel:regulation:customs-allowance",
    "field": "policy",
    "value": "면세 범위: 주류 3병(760ml 이하), 담배 200개비(거주자)/400개비(비거주자), 향수 2oz, 기타 품목 20만엔 이하. 초과 시 신고 및 관세 부과.",
    "observed_at": "2026-03-02",
    "validity": {
      "ttl_days": 90
    },
    "evidence_links": [
      "EU-0005"
    ],
    "confidence": 0.85,
    "status": "active"
  },
  {
    "ku_id": "KU-0007",
    "entity_key": "japan-travel:connectivity:sim-card",
    "field": "price",
    "value": {
      "7일_3GB": "약 1500-3000 JPY",
      "15일_무제한_저속": "약 3000-5000 JPY",
      "구매처": "공항 자판기, 편의점, 온라인 사전주문"
    },
    "observed_at": "2026-03-02",
    "validity": {
      "ttl_days": 180
    },
    "evidence_links": [
      "EU-0006"
    ],
    "confidence": 0.7,
    "status": "active"
  },
  {
    "ku_id": "KU-0008",
    "entity_key": "japan-travel:regulation:emergency",
    "field": "policy",
    "value": {
      "경찰": "110",
      "소방_구급": "119",
      "해상긴급": "118",
      "의료상담": "#7119",
      "관광헬프라인": "050-3816-2787",
      "재해전언다이얼": "171",
      "비고": "구급차 무료, 치료비는 별도. 119/110은 일본어 우선이나 통역 연결 가능."
    },
    "observed_at": "2026-03-02",
    "validity": {
      "ttl_days": 365
    },
    "evidence_links": [
      "EU-0007",
      "EU-0008"
    ],
    "confidence": 0.95,
    "status": "active"
  },
  {
    "ku_id": "KU-0009",
    "entity_key": "japan-travel:transport:airport-transfer",
    "field": "how_to_use",
    "value": {
      "나리타": {
        "Narita_Express": {
          "소요": "60분→도쿄역",
          "가격": "3070 JPY",
          "JR_Pass": true
        },
        "Skyliner": {
          "소요": "36분→닛포리",
          "가격": "약 2520 JPY"
        },
        "리무진버스": {
          "소요": "75-90분",
          "가격": "약 1500-3200 JPY"
        }
      },
      "하네다": {
        "모노레일": {
          "소요": "20분→하마마츠초",
          "가격": "약 500-600 JPY"
        },
        "게이큐선": {
          "소요": "15분→시나가와",
          "가격": "약 300 JPY"
        },
        "리무진버스": {
          "소요": "약 45분",
          "가격": "약 1000-1500 JPY"
        }
      }
    },
    "observed_at": "2026-03-02",
    "validity": {
      "ttl_days": 180
    },
    "evidence_links": [
      "EU-0009",
      "EU-0010"
    ],
    "confidence": 0.85,
    "status": "active"
  },
  {
    "ku_id": "KU-0010",
    "entity_key": "japan-travel:regulation:visit-japan-web",
    "field": "how_to_use",
    "value": "Visit Japan Web은 웹 기반 서비스(앱 불필요). 여권 정보, 입국심사(하선카드), 세관신고, 면세쇼핑 3개 항목 사전 등록. 등록 후 QR코드 발급 → 공항 도착 시 제시. 2026년 현재 필수는 아니나 강력 권장 (심사 시간 대폭 단축). 스크린샷 불가, 라이브 접속 필요.",
    "observed_at": "2026-03-02",
    "validity": {
      "ttl_days": 90
    },
    "evidence_links": [
      "EU-0012",
      "EU-0013"
    ],
    "confidence": 0.9,
    "status": "active"
  },
  {
    "ku_id": "KU-0011",
    "entity_key": "japan-travel:regulation:tax-free",
    "field": "policy",
    "value": {
      "현행_2025": {
        "최소금액": "5000 JPY (세전, 1일 1매장)",
        "대상": "비소모품+소모품 각 5000-500000 JPY",
        "절차": "여권 제시 → 매장 즉시 면세",
        "제한": "국제소포 발송 품목 면세 불가 (2025.4~)"
      },
      "신제도_2026_11월": {
        "방식": "환급형 (구매 시 세금 포함 → 출국 시 환급)",
        "최소금액_제한": "철폐",
        "봉인포장": "폐지"
      }
    },
    "observed_at": "2026-03-02",
    "validity": {
      "ttl_days": 90,
      "expires_at": "2026-11-01"
    },
    "evidence_links": [
      "EU-0014",
      "EU-0015"
    ],
    "confidence": 0.9,
    "status": "active"
  },
  {
    "ku_id": "KU-0012",
    "entity_key": "japan-travel:pass-ticket:suica",
    "field": "where_to_buy",
    "value": {
      "Welcome_Suica": {
        "판매처": "JR East Travel Service Center (나리타/하네다/도쿄/우에노/이케부쿠로/시부야/시나가와)",
        "보증금": "없음",
        "유효기간": "28일",
        "환불": "불가"
      },
      "Welcome_Suica_Mobile": {
        "대상": "iPhone (Apple Pay)",
        "유효기간": "180일"
      },
      "대안": "PASMO Passport (사철 역), ICOCA (관서 지역)"
    },
    "observed_at": "2026-03-02",
    "validity": {
      "ttl_days": 180
    },
    "evidence_links": [
      "EU-0016",
      "EU-0017"
    ],
    "confidence": 0.85,
    "status": "active"
  },
  {
    "ku_id": "KU-0013",
    "entity_key": "japan-travel:transport:shinkansen",
    "field": "price",
    "value": {
      "도쿄-교토": {
        "자유석": 13320,
        "지정석_Hikari": 14570,
        "Platt_Kodama": 10700
      },
      "도쿄-신오사카": {
        "지정석": 14720,
        "Platt_Kodama": 11110
      },
      "currency": "JPY",
      "구성": "기본운임 + 특급요금",
      "Nozomi추가": "210-1060 JPY"
    },
    "observed_at": "2026-03-02",
    "validity": {
      "ttl_days": 180
    },
    "evidence_links": [
      "EU-0018"
    ],
    "confidence": 0.85,
    "status": "active"
  }
]
